name,inn,legal_person,category,region,description,РРАР_score,site,contacts,source
ADMOS,7720688104,"ООО ""ЭДМОС-РЕКЛАМА""",Сувенирная продукция,Москва,Компания ADMOS специализируется на разработке концепций промо- и бизнес-подарков; оказывает услуги в области производства сувенирной продукции; занимается оформлением и производством печатных и POS-материалов.,905,https://www.admos-gifts.ru/,"7 (495) 646-15-10, zapros@admos.ru",https://alladvertising.ru/top/gifts/
Прагматика,6685136716,"ООО ""ПРАГМАТИКА""",Сувенирная продукция,Екатеринбург,"Рекламно-производственная компания представляет интересы ведущих сувенирных каталогов и предлагает огромный выбор рекламных и бизнес-сувениров российского и зарубежного производства, а так же оказывает услуги по нанесению фирменной символики и производству рекламной полиграфии.",875,https://pragmatica.gifts/,"7 (343) 253-15-76, info@pragmatica.ru",https://alladvertising.ru/top/gifts/
Иллан Gifts ,7801207313,"ООО ""КГИ""",Сувенирная продукция,Санкт-Петербург,Компания Иллан Gifts — одна из крупнейших российских компаний на рынке разработки и поставок качественной сувенирной продукции и бизнес-подарков с фирменной символикой.,802,https://illan-gifts.ru/,"7 (812) 704-84-71, illanspb+adv@illan.ru",https://alladvertising.ru/top/gifts/
ПрезенТайм,5258125282,"ООО ""ПРЕЗЕНТАЙМ""",Сувенирная продукция,Нижний Новгород,"Разработка, производство и продажа сувенирной продукции (деловые сувениры и подарки) из ведущих каталогов со склада в Нижнем Новгороде, а также оказание услуг по персонализации (нанесению символики).",910,https://presentime.online/,"7 (831) 216-13-13, info@presentime.su",https://alladvertising.ru/top/gifts/
ОКЕАН бизнес сувениров,6316160467,"ООО ""МАКРОС""",Сувенирная продукция,Самара,"Компания «Океан бизнес-сувениров» является одним из крупнейших оптовых поставщиков бизнес-сувениров и элитных подарков в России, а также оказывает широкий спектр услуг по нанесению фирменной символики.",861,https://www.oceangifts.ru/,"7 (846) 979-71-72, region@oceangifts.ru",https://alladvertising.ru/top/gifts/
Zeytz ,7722713109,"ООО ""ЗЕЙТЦ ПРОДЖЕКТ""",Сувенирная продукция,Москва,"Группа ZEYTZ — эксперт в производстве рекламной, полиграфической, сувенирной и текстильной продукции, оформлении мест продаж, автоматизации рекламных поставок в федеральные сети. Компании принадлежат крупнейшая в России интерьерная латексная типография и швейный цех «Швейц» в Рязани.",812,https://www.zeytz.ru/,"7 (495) 662-97-85, welcome@zeytz.ru",https://alladvertising.ru/top/gifts/
Grata Adv,7727713286,"ООО ""ГРАТА АДВ""",Сувенирная продукция,Москва,"Коммуникационное агентство полного цикла Grata Adv занимается организацией деловых, корпоративных и развлекательных мероприятий, реализацией и сопровождением выставочных проектов.",795,https://grata-adv.ru/,"7 (495) 961-00-06, grata@grata-adv.ru",https://alladvertising.ru/top/gifts/
Alter Ego,7705344797,"ООО ""АЛЬТЕР ЭГО ПРОМОУШН""",Сувенирная продукция,Москва,"Компания «Альтер Эго» занимается производством и поставкой сувениров и корпоративных подарков, сотрудничая с крупнейшими поставщиками из России, Европы и Китая. В перечне услуг компании: разработка идей и индивидуальный дизайн, изготовление сувенирной и полиграфической продукции, все виды нанесения и персонализации, упаковка и оформление наборов, собственная служба логистики и складской комплекс.",776,https://altereg.ru/,"7 (495) 150-30-77, info@altereg.ru",https://alladvertising.ru/top/gifts/
N:OW ,7707373225,"ООО ""НАУ""",Сувенирная продукция,Москва,"Агентство «N:OW» оказывает весь комплекс услуг в области коммуникаций и событийного маркетинга — от исследований, разработки идей, сценариев и механик, до организации мероприятий и полной интеграции брендов в крупные события.",555,https://now-agency.ru/,"7 953 435-91-63, hello@now-agency.ru",https://alladvertising.ru/top/gifts/
LBK Marketing Pro ,7743777640,"ООО ""ЛБК МАРКЕТИНГ ПРО""",Сувенирная продукция,Москва,"Сервисно-производственная компания «ЛБК Маркетинг Продакшен» является одним из лидеров в области разработки и производства POS-материалов и промо-дисплеев, а также промо-упаковки и различных рекламных материалов.",713,https://lbk-mpro.ru/,"7 (495) 989-12-36, zakaz@lbk-mpro.ru",https://alladvertising.ru/top/gifts/
Эклектика ,7704404228,"ООО ""ЭКЛЕКТИКА""",Сувенирная продукция,Москва,"Компания «Эклектика» специализируется на оптовых поставках сувенирной продукции и бизнес-подарков от известных мировых производителей, а также оказывает услуги по разработке индивидуальных решений и нанесению фирменной символики.",674,https://eklektika.ru/,"7 (495) 129-53-72, team@eklektika.ru",https://alladvertising.ru/top/gifts/
Эргономика ,2536300352,"ООО ПК ""КРС""",Сувенирная продукция,Владивосток,"Компания «Эргономика» — один из крупнейших игроков на рынке бизнес-сувениров на Дальнем Востоке России: подбор продукции по крупнейшим каталогам и производство сувениров по индивидуальным эскизам, нанесение фирменной символики любыми методами (тиснение, гравировка, шелкография, сублимация и т.д.)",641,https://krs-vl.ru/,"7 (423) 230-22-10, info@krs-vl.ru",https://alladvertising.ru/top/gifts/
яМайка ,781412373081,ИП Рогалев Кирилл Андреевич,Сувенирная продукция,Санкт-Петербург,"Сеть современных магазинов-типографий, позволяющих быстро выбрать и нанести свой дизайн на футболку, майку, толстовку и другой текстиль. Две студии находятся в Санкт-Петербурге и одна в Москве.",655,https://www.i-maika.ru/,"7 (812) 490-75-80, opt@i-maika.ru",https://alladvertising.ru/top/gifts/
Infinity Project ,7707778849,"ООО ""РПК ""ИНФИНИТИ""",Сувенирная продукция,Москва,"Infinity Project — рекламно-маркетинговое агентство полного цикла, помогающее брендам выстраивать коммуникацию с потребителями и партнёрами: разработка стратегий продвижения, организация спецпроектов и мероприятий, разработка сувенирной продукции, производство торгового оборудования, создание сайтов и контент-маркетинг.",611,https://infinity-project.ru/,"7 (495) 989-17-53, order@infinity-project.ru",https://alladvertising.ru/top/gifts/
STONEBLACK,7728202252,"ООО ""СТОУНБЛЭК""",Сувенирная продукция,Москва,"Компания STONEBLACK является крупным производителем корпоративной одежды (бейсболки, кепки, рубашки поло, толстовки, рюкзаки, куртки и т.д.), а также оказывает услуги дизайн-студии и обладает опытом в области разработки индивидуальных моделей корпоративной одежды.",685,https://www.stoneblack.ru/,"7 (495) 589-27-77, info@stoneblack.ru",https://alladvertising.ru/top/gifts/
Сувенир Медиа ,7714736550,"ООО ""СУВЕНИР МЕДИА""",Сувенирная продукция,Москва,"Компания «Сувенир Медиа» занимается оптовыми поставками брендированных сувениров, корпоративных подарков и другой промо-продукции.",630,https://suvmedia.ru/,"7 (495) 925-51-97, order@suvmedia.ru",https://alladvertising.ru/top/gifts/
Eventum Premo ,7701752869,"ООО ""ЕВЕНТУМ. КОНФЕРЕНЦИИ И СЕМИНАРЫ""",Event-management,Москва,"Компания Eventum Premo занимает одно из лидирующих мест в сфере корпоративных и маркетинговых коммуникаций. Агентство специализируется на организации и проведении крупномасштабных мероприятий, создании инсталляций и пространственных интеграций, PR и поддержке участия в выставках, продвижении в цифровой среде.",805,https://eventum-premo.ru/,"7 (495) 785-84-46, go@eventum-premo.ru",https://alladvertising.ru/top/event-management/
MAXIMICE ,7704628250,"ООО ""МАКСИМАЙС""",Event-management,Москва,"Организация бизнес-мероприятий — внутрикорпоративные, партнерские и клиентские мероприятия; нестандартные развлекательные и деловые события; презентации и роад-шоу; тимбилдинги и индивидуальные поездки; региональные программы и пресс-конференции и т.д.",803,https://maximice.ru/,"7 (495) 739-33-58, info@maximice.ru",https://alladvertising.ru/top/event-management/
WORLDS ,7714931520,"ООО ""ПИ ОУ ДИ ГРУПП""",Event-management,Москва,"Компания WORLDS — одно из ведущих event-агентств в России, занимающееся комплексным обслуживанием крупных корпоративных клиентов: организация корпоративных мероприятий, презентаций, конференций и тренингов, нестандартных активаций и интегрированных проектов.",897,https://wrlds.ru/,"7 (495) 225-73-21, brief@wrlds.ru",https://alladvertising.ru/top/event-management/
DoctorTeam,9715291509,"ООО ""ДОКТОР ТИМ""",Event-management,Москва,"DoctorTeam — эксперт в сфере организации корпоративных, маркетинговых и деловых мероприятий. В компетенцию агентства входят корпоративные праздники, тимбилдинги и разработка систем лояльности, конференции и выставки, бизнес-завтраки и пресс-туры, внутренний PR, а так же подготовка к открытию новых компаний, торговых точек и филиалов.",838,https://doctorteam.ru/,"7 (499) 340-82-32, hello@doctorteam.ru",https://alladvertising.ru/top/event-management/
Grata Adv ,7727713286,"ООО ""ГРАТА АДВ""",Event-management,Москва,"Коммуникационное агентство полного цикла Grata Adv занимается организацией деловых, корпоративных и развлекательных мероприятий, реализацией и сопровождением выставочных проектов.",795,https://grata-adv.ru/,"7 (495) 961-00-06, grata@grata-adv.ru",https://alladvertising.ru/top/event-management/
UTS ,7707545675,"ООО ""ЮТС""",Event-management,Москва,"Event-агентство UTS занимается организацией деловых поездок (MICE), корпоративных и маркетинговых мероприятий: конференций и семинаров, встреч и презентаций, а также спортивных проектов, выставок и фестивалей.",728,https://uts-event.ru/,"8 800 707-07-24, request@uts-event.ru",https://alladvertising.ru/top/event-management/
Market Group,7725578793,"АО ""МАРКОМ""",Event-management,Москва,"Коммуникационное агентство Market Group оказывает широкий спектр услуг в сферах PR и организации мероприятий, разработки и продвижения нестандартных проектов в цифровой среде.",741,https://themarketgroup.ru/,"7 (495) 137-70-25, info@themarketgroup.ru",https://alladvertising.ru/top/event-management/
OTIDO Group ,7810429305,"ООО ""ОТИДО ГРУПП""",Event-management,Санкт-Петербург,"Компания OTIDO предоставляет широкий спектр оборудования для технического обеспечения мероприятий в Москве и Санкт-Петербурге: аренда шатров и мебели, сценические конструкции, световое и звуковое оборудование, кейтеринг и элементы декора, а так же оказывает сопутствующие услуги по организации событий.",755,https://www.otido-group.ru/,"7 (812) 677-55-01, spb@otido-group.ru",https://alladvertising.ru/top/event-management/
StagePro,7841025951,"ООО ""СТЕЙДЖПРО""",Event-management,Санкт-Петербург,"StagePro — крупнейшая сценическая компания в сфере технического обеспечения мероприятий на Северо-Западе России: поставки конструкций и оборудования, оформление мероприятий и производство декораций, полное техническое обеспечение и сопровождение проектов.",745,https://stagepro.ru/,"7 (812) 601-06-48, info@stagepro.ru",https://alladvertising.ru/top/event-management/
Невент ,6318035373,"ООО ""НЕВЕНТ""",Event-management,Самара,"Компания «Невент» объединяет команду специалистов в области организации программ тимбилдинга, квестов, тренингов и бизнес-игр, деловых мероприятий и корпоративных праздников.",731,https://nevent.ru/,"8 800 550-40-35, nevent@inbox.ru",https://alladvertising.ru/top/event-management/
Sobytie Communications,7717582845,"ООО ""КГ СОБЫТИЕ""",Event-management,Москва,"Коммуникационная группа «Событие» оказывает весь спектр услуг на рынке маркетинговых коммуникаций: от разработки комплексных стратегий и креативных концепций до реализации медийных кампаний, PR, Event- и BTL-проектов.",680,https://so-bytie.ru/,"7 (495) 741-36-01,  info@so-bytie.ru",https://alladvertising.ru/top/event-management/
N:OW ,7707373225,"ООО ""НАУ""",Event-management,Москва,"Агентство «N:OW» оказывает весь комплекс услуг в области коммуникаций и событийного маркетинга — от исследований, разработки идей, сценариев и механик, до организации мероприятий и полной интеграции брендов в крупные события.",555,https://now-agency.ru/,"7 953 435-91-63, hello@now-agency.ru",https://alladvertising.ru/top/event-management/
Win2Win Communications,7714966378,"ООО ""ГРУППА КОМПАНИЙ ВИН ТУ ВИН КОММУНИКЕЙШНЗ""",Event-management,Москва,"Коммуникационное агентство Win2Win Communications оказывает широкий спектр услуг по разработке и реализации стратегий взаимодействия с аудиторией, сотрудниками и партнерами.",589,https://win2win.ru/,"7 (495) 664-48-00,  info@win2win.ru",https://alladvertising.ru/top/event-management/
SUR event agency,5262153652,"ООО ""СТУДИЯ СЮРПРИЗ""",Event-management,Нижний Новгород,"Event-агентство SUR («Студия Сюрприз») создаёт различные мероприятия и реализует комплексные коммуникационные стратегии, усиливающие бренды, вовлекающие аудиторию и дающие измеримые результаты. Агентство является одним из лидеров в сфере организации корпоративных мероприятий и событийного маркетинга, реализуя проекты, направленные на решение HR и маркетинговых задач.",594,https://www.surpriznn.ru/,"7 (831) 422-81-04, info@surpriznn.ru",https://alladvertising.ru/top/event-management/
Redday event,7743770718,"ООО ""РЭДДЭЙ""",Event-management,Москва,"Событийное агентство Redday event специализируется на организации масштабных мероприятий: корпоративные праздники, конференции, презентации, официальные встречи и т.д.",617,https://redday.events/,"7 (495) 180-04-20, info@redday.ec",https://alladvertising.ru/top/event-management/
BIG JACK,9717024629,"ООО ""БИГ ДЖЕК""",Event-management,Москва,"Event-агентство BIG JACK специализируется на организации масштабных деловых событий, корпоративных мероприятий, тренингов и тимбилдингов, конференций и семинаров, а также крупных промо-мероприятий (запуск новых брендов, открытие магазинов).",570,https://bigjack24.ru/,"7 985 760-08-01, sales@bigjack24.ru",https://alladvertising.ru/top/event-management/
Атомэкспо,7701597035,"ООО ""АТОМЭКСПО""",Event-management,Москва,"Компания «Атомэкспо» предлагает комплекс услуг в сфере организационной поддержки выставок, презентаций и других деловых мероприятий — от разработки концепции, подбора и оформления площадки до привлечения участников и информационной поддержки.",642,https://atomexpo.com/,"7 (499) 922-89-95, mail@atomexpo.com",https://alladvertising.ru/top/event-management/
ABD: Entertainment ,7723871115,"ООО ""АБД""",Event-management,Москва,"Event-студия «ABD: Entertainment» занимается организацией маркетинговых и деловых мероприятий, корпоративных и частных событий; разрабатывает креативные концепции и сценарии.",628,https://abd-ent.ru/,"7 (495) 107-05-24, info@abd-ent.ru",https://alladvertising.ru/top/event-management/
TWIGA,7726253808,"ООО РА ""ТВИГА""",Event-management,Москва,"TWIGA Communication Group — крупнейшая независимая коммуникационная группа на территории СНГ, предлагающая все виды услуг в области коммуникаций: реклама, продвижение продукции, стимулирование продаж, креатив, дизайн, BTL, PR, медиа, digital, маркетинг.",1870,https://twiga.ru/,"7 (495) 987-35-95, ask@twiga.ru",https://alladvertising.ru/top/event-management/
emg ,7701810493,ООО «ЭМГ»,Мерчандайзинг,Москва,"emg — одно из крупнейших российских агентств, занимающееся организацией интегрированных маркетинговых коммуникаций, масштабных BTL-акций, рекламных и PR-кампаний.",1202,https://emg.ru/,"7 (495) 797-86-64, emg@emg.ru",https://alladvertising.ru/top/merchandising/
DIXI PRO ,7718882418,"ООО ""ДИКСИ ПРО""",Мерчандайзинг,Москва,"РПК «DIXI PRO» оказывает полный спектр услуг в области оформления торговых пространств: разработка POS-материалов, изготовление специальных конструкций для ритейла, технический мерчандайзинг и т.д.",763,https://dixipro.ru/,"7 (499) 110-31-66, incor@dixipro.ru",https://alladvertising.ru/top/merchandising/
Zeytz ,7722713109,"ООО ""ЗЕЙТЦ ПРОДЖЕКТ""",Мерчандайзинг,Москва,"Группа ZEYTZ — эксперт в производстве рекламной, полиграфической, сувенирной и текстильной продукции, оформлении мест продаж, автоматизации рекламных поставок в федеральные сети. Компании принадлежат крупнейшая в России интерьерная латексная типография и швейный цех «Швейц» в Рязани.",812,https://www.zeytz.ru/,"7 (495) 662-97-85, welcome@zeytz.ru",https://alladvertising.ru/top/merchandising/
OPEN Group ,7725693725,"ООО ""ОУПЕН МСК""",Мерчандайзинг,Москва,"Агентство маркетинговых коммуникаций OPEN специализируется в области немедийных коммуникаций и предоставляет полный комплекс интегрированных маркетинговых услуг: мерчандайзинг и промо-активности в местах продаж, торговый маркетинг, организация мероприятий, продвижение в digital-среде. Агентство активно внедряет инновационные технологии в управление персоналом и мерчандайзинг.",1571,https://open-com.ru/,"7 (499) 649-00-80, sales@open-com.ru",https://alladvertising.ru/top/merchandising/
