name,inn,legal_person,category,region,description,РРАР_score,site,contacts,source
Market Group,7725578793,"АО ""МАРКОМ""",PR агентства,Москва,"Коммуникационное агентство Market Group оказывает широкий спектр услуг в сферах PR и организации мероприятий, разработки и продвижения нестандартных проектов в цифровой среде.",741,https://themarketgroup.ru/,"7 (495) 137-70-25, info@themarketgroup.ru",https://alladvertising.ru/top/pr/
VINCI Agency,9729062516,"ООО ""АГЕНТСТВО МАССИРОВАННЫХ КОММУНИКАЦИЙ""",PR агентства,Москва,"VINCI Agency специализируется на PR-услугах — от аналитики и разработки стратегии, работе со СМИ и новыми медиа до организации конференций и семинаров, а также пресс-ивентов различного масштаба.",715,https://vincipr.com/,"7 912 061-03-00, hello@vincipr.com",https://alladvertising.ru/top/pr/
PromoAge,7716851975,"ООО ""ПРОМОЭЙДЖ""",PR агентства,Москва,Агентство PromoAge специализируется на разработке и реализации комплексных коммуникационных кампаний — от организации пресс-конференций до масштабных PR-кампаний в классических и цифровых медиа.,637,https://promoage.ru/,"7 (495) 796-84-86, welcome@promoage.ru",https://alladvertising.ru/top/pr/
GREATIVE,7751181321,"ООО ""ГРИЭЙТИВ""",PR агентства,Москва,"Коммуникационное агентство GREATIVE оказывает помощь в развитии бизнеса: PR и корпоративные коммуникации, комплексный маркетинг и консалтинг, организация бизнес-мероприятий и рекламных кампаний, брендинг и коммуникационный дизайн, контент-маркетинг и сотрудничество с лидерами мнений.",687,https://greative.pro/,"7 (495) 788-67-84, love@greative.pro",https://alladvertising.ru/top/pr/
Sobytie Communications,7717582845,"ООО ""КГ СОБЫТИЕ""",PR агентства,Москва,"Коммуникационная группа «Событие» оказывает весь спектр услуг на рынке маркетинговых коммуникаций: от разработки комплексных стратегий и креативных концепций до реализации медийных кампаний, PR, Event- и BTL-проектов.",680,https://so-bytie.ru/,"7 (495) 741-36-01,  info@so-bytie.ru",https://alladvertising.ru/top/pr/
N:OW,7707373225,"ООО ""НАУ""",PR агентства,Москва,"Агентство «N:OW» оказывает весь комплекс услуг в области коммуникаций и событийного маркетинга — от исследований, разработки идей, сценариев и механик, до организации мероприятий и полной интеграции брендов в крупные события.",555,https://now-agency.ru/,"7 953 435-91-63, hello@now-agency.ru",https://alladvertising.ru/top/pr/
Менделеев,7203596568,"ООО ""МЕНДЕЛЕЕВ""",PR агентства,Тюмень,"Коммуникационное агентство «МЕНДЕЛЕЕВ» предлагает экспертизу в интернет-маркетинге, веб-разработке, PR и GR, дизайне и продакшне. Команда агентства проводит исследования и разрабатывает стратегии, создаёт дизайн и контент, предлагает актуальные инструменты для продвижения бизнеса.",592,https://менделеев.рф/,"8 800 222-20-90, sales@mendeleevm.ru",https://alladvertising.ru/top/pr/
AGT Communications Group,7701268785,"ООО ""АГТ""",PR агентства,Москва,"Одна из крупнейших российских компаний на рынке связей с общественностью, имеющая разветвленную сеть дочерних компаний в регионах России и странах ближнего зарубежья",1403,https://agt.agency/,"7 (495) 624-03-01, info@agt-agency.ru",https://alladvertising.ru/top/pr/
Win2Win Communications,7714966378,"ООО ""ГРУППА КОМПАНИЙ ВИН ТУ ВИН КОММУНИКЕЙШНЗ""",PR агентства,Москва,"Коммуникационное агентство Win2Win Communications оказывает широкий спектр услуг по разработке и реализации стратегий взаимодействия с аудиторией, сотрудниками и партнерами.",589,https://win2win.ru/,"7 (495) 664-48-00,  info@win2win.ru",https://alladvertising.ru/top/pr/
COMUNICA ,7714826571,"ООО ""КОМЬЮНИТИ""",PR агентства,Москва,"Креативное агентство COMUNICA предлагает эффективные решения для продвижения бизнеса с помощью интегрированных PR и New Media инструментов, занимается исследованиями и стратегическим консалтингом в сфере внутрикорпоративных коммуникаций и PR во всех видах медиа",641,https://www.comunica.ru/,"7 (495) 937-19-14,  mail@comunica.ru",https://alladvertising.ru/top/pr/
Redline PR,502478137235,ИП Кириченко Анна Александровна,PR агентства,Москва,Коммуникационное агентство Redline PR специализируется на оказании полного цикла услуг для среднего и крупного бизнеса на территории России и в странах СНГ.,568,https://redline-pr.ru/,"7 926 579-88-17, pr@redline-pr.ru",https://alladvertising.ru/top/pr/
Infomost Communications,7704782043,"ООО ""ИНФОМОСТ"" ",PR агентства,Москва,"PR-агентство Infomost Communications оказывает комплекс услуг в области корпоративных и финансовых коммуникаций, занимается работой со СМИ и цифровыми медиа, создаёт годовые отчёты, работает над выстраиванием деловой репутации.",651,https://im-com.ru/,"7 (495) 532-28-25, info@im-com.ru",https://alladvertising.ru/top/pr/
2L,5047152336,ООО «ПРЕМИКОМ»,PR агентства,Москва,"Коммуникационное агентство полного цикла «2L» оказывает широкий спектр услуг в области маркетинга и PR, специализируясь на сопровождении IT-брендов.",631,https://2l-pr.ru/,"7 (499) 322-20-74, sales@2l-pr.ru",https://alladvertising.ru/top/pr/
ДругМедиа ,1660173763,ООО «ДругМедиа»,PR агентства,Казань,"Бюро «ДругМедиа» оказывает полный спектр услуг в сфере маркетинга и PR в социальных медиа и блогосфере: развитие и продвижение сообществ (SMM); размещение таргетированной рекламы и публикаций в группах; проведение конкурсов, мониторинг и работа с репутацией (SERM), вирусные кампании.",651,https://drugmedia.ru/,"7 (843) 202-42-41, privet@drugmedia.ru",https://alladvertising.ru/top/pr/